{
  "$schema": "../../schemas/dependency.json",
  "name": "SD-JWT-JS",
  "url": "https://github.com/openwallet-foundation-labs/sd-jwt-js",
  "description": "A TypeScript implementation of the Selective Disclosure JWT (SD-JWT) spec.",
  "community": "https://discord.gg/openwalletfoundation",
  "language": "TypeScript",
  "license": "Apache 2.0"
}
